{
  "schemaVersion": "CZA-RECOVERY-JOURNAL-V4",
  "runId": "01J8ABCDEFGHJKMNPQRSTVWXYZ",
  "environment": "staging-security-lab",
  "createdAt": "2026-09-15T00:00:00Z",
  "expiresAt": "2026-09-15T04:00:00Z",
  "mutations": [
    {
      "sequence": 1,
      "provider": "neon",
      "resourceKind": "project",
      "deterministicLabel": "cza-f3-neon-project-01J8ABCDEFGHJKMNPQRSTVWXYZ",
      "providerResourceId": null,
      "state": "PREPARED",
      "checkpointSha256": "0000000000000000000000000000000000000000000000000000000000000000"
    }
  ]
}
